{
  "id": "capability.standard",
  "candidateWrites": true,
  "temporaryWrites": true,
  "subprocesses": "repository-toolchain",
  "network": {
    "mode": "none"
  },
  "credentials": "none",
  "externalEffects": [],
  "digest": "sha256:0101010101010101010101010101010101010101010101010101010101010101"
}
